{
  "name": "JavaScript Mock Tool Bundle",
  "commit": "f7g8h9i0",
  "commit_date": "2024-01-31T16:45:00Z",
  "description": "A comprehensive collection of mock analysis tools for testing ToolVault's JavaScript toolset architecture",
  "author": "ToolVault Development Team",
  "license": "MIT",
  "bundle_format": "javascript",
  "runtime": "browser",
  "tools": [
    {
      "id": "translate",
      "commit": "a1b2c3d4",
      "commit_date": "2024-01-15T14:30:00Z",
      "name": "Translate Features",
      "labels": ["transform", "geometry"],
      "description": "Translate geometric features by distance and direction or simple dx/dy offsets",
      "input_types": ["Feature", "FeatureCollection", "Point", "LineString", "Polygon"],
      "output_types": ["Feature", "FeatureCollection", "Point", "LineString", "Polygon"],
      "isTemporal": false,
      "parameters": [
        {
          "name": "distance",
          "type": "number",
          "default": 0,
          "description": "Distance to translate (meters)"
        },
        {
          "name": "direction",
          "type": "number", 
          "default": 0,
          "description": "Direction in degrees (0=North, 90=East)"
        },
        {
          "name": "units",
          "type": "string",
          "default": "meters",
          "enum": ["meters", "kilometers"],
          "description": "Distance units"
        },
        {
          "name": "dx",
          "type": "number",
          "default": 0,
          "description": "Simple offset in longitude (degrees)"
        },
        {
          "name": "dy", 
          "type": "number",
          "default": 0,
          "description": "Simple offset in latitude (degrees)"
        }
      ],
      "examples": [
        {
          "name": "Move 1km North",
          "parameters": { "distance": 1000, "direction": 0, "units": "meters" }
        },
        {
          "name": "Simple offset",
          "parameters": { "dx": 0.01, "dy": 0.01 }
        }
      ]
    },
    {
      "id": "flip-horizontal",
      "commit": "b2c3d4e5",
      "commit_date": "2024-01-15T10:15:00Z",
      "name": "Flip Horizontal",
      "labels": ["transform", "geometry"],
      "description": "Flip features horizontally around the longitude or latitude axis",
      "input_types": ["Feature", "FeatureCollection", "Point", "LineString", "Polygon"],
      "output_types": ["Feature", "FeatureCollection", "Point", "LineString", "Polygon"],
      "isTemporal": false,
      "parameters": [
        {
          "name": "axis",
          "type": "string",
          "default": "longitude",
          "enum": ["longitude", "latitude"],
          "description": "Axis to flip around"
        }
      ],
      "examples": [
        {
          "name": "Mirror longitude",
          "parameters": { "axis": "longitude" }
        }
      ]
    },
    {
      "id": "flip-vertical", 
      "commit": "c3d4e5f6",
      "commit_date": "2024-01-15T10:15:00Z",
      "name": "Flip Vertical",
      "labels": ["transform", "geometry"],
      "description": "Flip features vertically around the latitude axis",
      "input_types": ["Feature", "FeatureCollection", "Point", "LineString", "Polygon"],
      "output_types": ["Feature", "FeatureCollection", "Point", "LineString", "Polygon"],
      "isTemporal": false,
      "parameters": [],
      "examples": [
        {
          "name": "Mirror latitude",
          "parameters": {}
        }
      ]
    },
    {
      "id": "speed-series",
      "commit": "d4e5f6g7",
      "commit_date": "2024-01-18T09:45:00Z",
      "name": "Calculate Speed Series", 
      "labels": ["analysis", "temporal"],
      "description": "Calculate speed time series from GPS track with timestamps",
      "input_types": ["LineString"],
      "output_types": ["array"],
      "isTemporal": true,
      "parameters": [
        {
          "name": "time_unit",
          "type": "string", 
          "default": "seconds",
          "enum": ["seconds", "minutes", "hours"],
          "description": "Time unit for speed calculation"
        },
        {
          "name": "smoothing",
          "type": "boolean",
          "default": false,
          "description": "Apply smoothing to speed values"
        },
        {
          "name": "window_size",
          "type": "number",
          "default": 3,
          "description": "Smoothing window size"
        }
      ],
      "examples": [
        {
          "name": "Speed in m/s",
          "parameters": { "time_unit": "seconds" }
        },
        {
          "name": "Smoothed speed in km/h",
          "parameters": { "time_unit": "hours", "smoothing": true, "window_size": 5 }
        }
      ]
    },
    {
      "id": "direction-series",
      "commit": "e5f6g7h8",
      "commit_date": "2024-01-20T11:20:00Z",
      "name": "Calculate Direction Series",
      "labels": ["analysis", "temporal"], 
      "description": "Calculate bearing/direction time series from GPS track",
      "input_types": ["LineString"],
      "output_types": ["array"],
      "isTemporal": true,
      "parameters": [
        {
          "name": "smoothing",
          "type": "boolean",
          "default": false, 
          "description": "Apply smoothing to direction values"
        },
        {
          "name": "window_size",
          "type": "number",
          "default": 3,
          "description": "Smoothing window size"
        }
      ],
      "examples": [
        {
          "name": "Raw bearings", 
          "parameters": { "smoothing": false }
        },
        {
          "name": "Smoothed bearings",
          "parameters": { "smoothing": true, "window_size": 5 }
        }
      ]
    },
    {
      "id": "average-speed",
      "commit": "f6g7h8i9",
      "commit_date": "2024-01-22T16:30:00Z",
      "name": "Calculate Average Speed",
      "labels": ["statistics", "temporal"],
      "description": "Calculate the average speed over an entire GPS track",
      "input_types": ["LineString"],
      "output_types": ["number"],
      "isTemporal": true,
      "parameters": [
        {
          "name": "time_unit",
          "type": "string",
          "default": "seconds", 
          "enum": ["seconds", "minutes", "hours"],
          "description": "Time unit for speed calculation"
        }
      ],
      "examples": [
        {
          "name": "Average speed m/s",
          "parameters": { "time_unit": "seconds" }
        },
        {
          "name": "Average speed km/h", 
          "parameters": { "time_unit": "hours" }
        }
      ]
    },
    {
      "id": "speed-histogram",
      "commit": "g7h8i9j0",
      "commit_date": "2024-01-25T13:15:00Z",
      "name": "Create Speed Histogram",
      "labels": ["statistics", "temporal"],
      "description": "Generate a histogram of speeds from GPS track data",
      "input_types": ["LineString"],
      "output_types": ["object"],
      "isTemporal": true,
      "parameters": [
        {
          "name": "bins",
          "type": "number",
          "default": 10,
          "description": "Number of histogram bins"
        },
        {
          "name": "time_unit",
          "type": "string", 
          "default": "seconds",
          "enum": ["seconds", "minutes", "hours"],
          "description": "Time unit for speed calculation"
        }
      ],
      "examples": [
        {
          "name": "10-bin histogram", 
          "parameters": { "bins": 10, "time_unit": "seconds" }
        },
        {
          "name": "20-bin histogram in km/h",
          "parameters": { "bins": 20, "time_unit": "hours" }
        }
      ]
    },
    {
      "id": "smooth-polyline",
      "commit": "h8i9j0k1",
      "commit_date": "2024-01-28T10:00:00Z",
      "name": "Smooth Polyline",
      "labels": ["processing", "geometry"], 
      "description": "Apply smoothing algorithms to LineString geometries",
      "input_types": ["Feature", "FeatureCollection", "LineString"],
      "output_types": ["Feature", "FeatureCollection", "LineString"],
      "isTemporal": false,
      "parameters": [
        {
          "name": "algorithm",
          "type": "string",
          "default": "gaussian",
          "enum": ["gaussian", "moving_average"],
          "description": "Smoothing algorithm to use"
        },
        {
          "name": "window_size",
          "type": "number",
          "default": 3,
          "description": "Smoothing window size"
        }
      ],
      "examples": [
        {
          "name": "Gaussian smoothing",
          "parameters": { "algorithm": "gaussian", "window_size": 3 }
        },
        {
          "name": "Moving average",
          "parameters": { "algorithm": "moving_average", "window_size": 5 }
        }
      ]
    },
    {
      "id": "export-csv",
      "commit": "i9j0k1l2",
      "commit_date": "2024-01-30T14:45:00Z",
      "name": "Export to CSV",
      "labels": ["io", "export"],
      "description": "Export GeoJSON features to CSV format with coordinates and properties",
      "input_types": ["Feature", "FeatureCollection", "Point", "LineString", "Polygon"],
      "output_types": ["string"],
      "isTemporal": false,
      "parameters": [
        {
          "name": "include_properties",
          "type": "boolean",
          "default": false,
          "description": "Include feature properties in CSV output"
        },
        {
          "name": "coordinate_format",
          "type": "string",
          "default": "separate", 
          "enum": ["separate", "wkt"],
          "description": "How to format coordinates"
        },
        {
          "name": "separator",
          "type": "string",
          "default": ",",
          "description": "CSV field separator"
        }
      ],
      "examples": [
        {
          "name": "Basic CSV",
          "parameters": { "include_properties": false }
        },
        {
          "name": "CSV with properties",